{
  "id": "documental-diaspora-global",
  "title": {
    "es": "La Diáspora Culinaria: Cómo la Tortilla de Patatas Conquistó el Mundo",
    "en": "The Culinary Diaspora: How the Spanish Tortilla Conquered the World",
    "de": "Die kulinarische Diaspora: Wie die spanische Tortilla die Welt eroberte"
  },
  "description": {
    "es": "Desde las tabernas de Madrid y Berlín hasta los bares de tapas en Tokio y Buenos Aires: la evolución y adaptación internacional de un icono global.",
    "en": "From Madrid and Berlin taverns to tapas bars in Tokyo and Buenos Aires: the evolution and international journey of a global culinary icon.",
    "de": "Von den Tavernen in Madrid und Berlin bis zu den Tapas-Bars in Tokio und Buenos Aires: die weltweite Entwicklung eines kulinarischen Kulturguts."
  },
  "thumbnailUrl": "/images/personas/elena.svg",
  "duration": 1520,
  "lang": "es",
  "category": "history",
  "relatedRecipeIds": [
    "express",
    "sobrasada-mallorquina"
  ],
  "publishedAt": "2026-05-01T15:00:00Z"
}
